{"schemaVersion":"1.0","traceId":"synthetic-multi-event","baselineSource":{"producerType":"harness","producerName":"example-harness","producerVersion":"2.3.0","evidenceBasis":"historical-analysis"},"obligationBudgets":[{"obligationId":"obl-a","eventBudget":10},{"obligationId":"obl-b","eventBudget":1}]}
